{
    "model": "ThurstoneMostellerPart",
    "func": "rate",
    "data": {
        "teams": [
            [{"mu": 25.0, "sigma": 8.333}],
            [{"mu": 25.0, "sigma": 8.333}]
        ]
    },
    "params": {
        "mu": 25.0,
        "sigma": 8.3333,
        "beta": 4.1667,
        "kappa": 0.0001,
        "tau": 0.0833,
        "margin": 0.0,
        "window_size": 4,
        "limit_sigma": false,
        "balance": false
    }
}
